{
  "$schema": "https://json-schema.org/draft/2020-12/schema",
  "$id": "https://fa3.local/contracts/FA3-UAF-ACTION-CONTRACT-001.schema.json",
  "x-fa3-contract-id": "FA3-UAF-ACTION-CONTRACT-001",
  "title": "FA3 UAF Action Contract",
  "type": "object",
  "required": [
    "schema",
    "id",
    "version",
    "description",
    "input_schema",
    "output_schema",
    "semantics",
    "exposure",
    "security",
    "resources",
    "provider",
    "evidence"
  ],
  "properties": {
    "schema": {
      "const": "fa3.uaf.action-contract.v1"
    },
    "id": {
      "type": "string",
      "minLength": 1
    },
    "version": {
      "type": "string",
      "minLength": 1
    },
    "description": {
      "type": "string"
    },
    "input_schema": {
      "type": "object"
    },
    "output_schema": {
      "type": "object"
    },
    "semantics": {
      "type": "object"
    },
    "exposure": {
      "type": "object"
    },
    "security": {
      "type": "object"
    },
    "resources": {
      "type": "object"
    },
    "provider": {
      "type": "object"
    },
    "evidence": {
      "type": "object"
    }
  },
  "additionalProperties": false
}
