{"schema":"fa3.uaf.action-contract.v1","id":"marketing.newsletter.prepare","version":"1.0.0","description":"Prepare a listmonk newsletter projection without dispatch.","input_schema":{"type":"object","required":["operation_id","payload_ref","candidate_ids"],"properties":{"operation_id":{"type":"string"},"payload_ref":{"type":"string"},"candidate_ids":{"type":"array","items":{"type":"string"}},"context_refs":{"type":"array","items":{"type":"string"}}},"additionalProperties":false},"output_schema":{"type":"object","required":["status","provider_id","decision_receipt","evidence_refs"],"properties":{"status":{"type":"string"},"provider_id":{"type":"string"},"decision_receipt":{"type":"object"},"evidence_refs":{"type":"array","items":{"type":"string"}}},"additionalProperties":false},"semantics":{"mutating":true,"idempotent":true,"retry_safe":true,"long_running":false},"exposure":{"gui":true,"agent":true,"cli":true,"mcp":true,"a2a":true,"automation":true,"http":false},"security":{"authentication":"required","authorization":"required","approval":"policy","audit":"required"},"resources":{"hrb_required":false,"cpu":{"physical_cores":{"minimum":0},"logical_processors":null},"accelerator":{"required":false,"cardinality":"0..N"},"memory":{"admission":"provider-declared"}},"provider":{"selection":"policy-bounded-capability-match","preferred_role":"FA3-PROVIDER-LISTMONK-001"},"evidence":{"required":true,"decision_receipt_required":true}}
