{"schema":"fa3.uaf.action-contract.v1","id":"caption.editorial.project","version":"1.0.0","description":"Project canonical captions to Kdenlive, QuickClip or Creative Studio while retaining editable semantics.","input_schema":{"type":"object","required":["document","target"],"properties":{"document":{"type":"object"},"target":{"type":"string"}},"additionalProperties":false},"output_schema":{"type":"object","required":["status","artifact","evidence_refs"],"properties":{"status":{"type":"string"},"artifact":{"type":"object"},"evidence_refs":{"type":"array","items":{"type":"string"}}},"additionalProperties":false},"semantics":{"mutating":false,"idempotent":true,"retry_safe":true,"long_running":false},"exposure":{"gui":true,"agent":true,"cli":true,"mcp":true,"a2a":true,"automation":true,"http":false},"security":{"authentication":"required","authorization":"required","approval":"none","audit":"required"},"resources":{"hrb_required":false,"cpu":{"physical_cores":{"minimum":0},"logical_processors":null},"accelerator":{"required":false,"cardinality":"0..N"},"memory":{"admission":"provider-declared"}},"provider":{"selection":"policy-bounded-capability-match","preferred_role":"FA3-PROVIDER-CAPTION-NATIVE-001"},"evidence":{"required":true,"decision_receipt_required":true}}
